{
  "$schema": "https://json-schema.org/draft/2020-12/schema",
  "$id": "https://github.com/revazi/pi-reads/schemas/v1/config.schema.json",
  "title": "Pi Reads configuration",
  "type": "object",
  "additionalProperties": false,
  "required": ["schemaVersion"],
  "properties": {
    "schemaVersion": {
      "const": 1
    },
    "libraryDir": {
      "type": "string",
      "minLength": 1
    },
    "defaults": {
      "type": "object",
      "additionalProperties": false,
      "properties": {
        "mode": {
          "enum": ["archive", "digest", "synthesis"]
        },
        "exportFormat": {
          "enum": ["markdown", "html", "pdf", "epub"]
        },
        "digestTemplateId": {
          "type": "string",
          "pattern": "^[a-z][a-z0-9-]{1,63}$"
        },
        "synthesisTemplateId": {
          "type": "string",
          "pattern": "^[a-z][a-z0-9-]{1,63}$"
        }
      }
    },
    "generationTemplates": {
      "type": "array",
      "maxItems": 10,
      "items": {
        "$ref": "generation-template.schema.json#/$defs/definition"
      }
    },
    "kindle": {
      "type": "object",
      "additionalProperties": false,
      "properties": {
        "deviceLabel": {
          "type": "string",
          "minLength": 1
        },
        "defaultFormat": {
          "enum": ["epub", "pdf"]
        },
        "credentialStore": {
          "enum": ["system", "environment"]
        },
        "credentialProfile": {
          "type": "string",
          "pattern": "^[a-z0-9][a-z0-9._-]{0,63}$"
        },
        "recipientEnv": {
          "type": "string",
          "pattern": "^[A-Z_][A-Z0-9_]*$"
        },
        "smtp": {
          "type": "object",
          "additionalProperties": false,
          "properties": {
            "host": {
              "type": "string",
              "minLength": 1
            },
            "port": {
              "type": "integer",
              "minimum": 1,
              "maximum": 65535
            },
            "secure": {
              "type": "boolean"
            },
            "userEnv": {
              "type": "string",
              "pattern": "^[A-Z_][A-Z0-9_]*$"
            },
            "passwordEnv": {
              "type": "string",
              "pattern": "^[A-Z_][A-Z0-9_]*$"
            },
            "fromEnv": {
              "type": "string",
              "pattern": "^[A-Z_][A-Z0-9_]*$"
            }
          }
        }
      }
    },
    "obsidian": {
      "type": "object",
      "additionalProperties": false,
      "required": ["vaultPath"],
      "properties": {
        "vaultPath": {
          "type": "string",
          "minLength": 1
        },
        "vaultName": {
          "type": "string",
          "minLength": 1
        },
        "inboxFolder": {
          "type": "string",
          "minLength": 1
        },
        "attachmentFolder": {
          "type": "string",
          "minLength": 1
        },
        "noteNameTemplate": {
          "type": "string",
          "minLength": 1
        },
        "tags": {
          "type": "array",
          "uniqueItems": true,
          "items": {
            "type": "string",
            "minLength": 1
          }
        },
        "frontmatter": {
          "type": "object",
          "additionalProperties": {
            "oneOf": [
              { "type": "string" },
              { "type": "number" },
              { "type": "boolean" },
              {
                "type": "array",
                "items": {
                  "type": "string",
                  "minLength": 1
                }
              }
            ]
          }
        },
        "openAfterExport": {
          "type": "boolean"
        }
      }
    }
  }
}
