{
  "schemaVersion": 1,
  "libraryDir": "~/Documents/pi-reads",
  "defaults": {
    "mode": "archive",
    "exportFormat": "pdf",
    "digestTemplateId": "brief",
    "synthesisTemplateId": "research-note"
  },
  "generationTemplates": [
    {
      "id": "custom-team-note",
      "version": 1,
      "label": "Team note",
      "mode": "synthesis",
      "targetWords": { "minimum": 600, "maximum": 1200 },
      "sectionRoles": ["context", "findings", "limitations", "conclusion"],
      "coveragePolicy": "targeted",
      "citationBudget": { "minimumPerSection": 1, "minimumSources": 1 }
    }
  ],
  "obsidian": {
    "vaultPath": "~/Documents/MyVault",
    "vaultName": "MyVault",
    "inboxFolder": "Reading Inbox",
    "attachmentFolder": "Attachments/pi-reads",
    "noteNameTemplate": "{{title}}",
    "tags": [
      "pi-reads"
    ],
    "frontmatter": {
      "status": "to-read"
    },
    "openAfterExport": false
  },
  "kindle": {
    "deviceLabel": "My Kindle",
    "defaultFormat": "epub",
    "credentialStore": "system",
    "credentialProfile": "default",
    "recipientEnv": "PI_READS_KINDLE_ADDRESS",
    "smtp": {
      "host": "smtp.example.com",
      "port": 587,
      "secure": false,
      "userEnv": "PI_READS_SMTP_USER",
      "passwordEnv": "PI_READS_SMTP_PASSWORD",
      "fromEnv": "PI_READS_SMTP_FROM"
    }
  }
}
